<?xml version="1.0" encoding="UTF-8"?>
<!DOCTYPE application SYSTEM "../doc/jsfront.dtd">
<application name="App" version="1.0" theme="google" onCreationComplete="onCreationComplete">
    <!-- <package name="custom" theme="false">libs/custom/</package> -->

    <import src="application.js" />
    
    <import src="jsf.core.Alert" />
    <import src="jsf.ui.JToolbar"     autoload="toolbar" />
    <import src="jsf.ui.JMenubar"     autoload="menubar" />
    <import src="jsf.ui.JSeparator"   autoload="separator" />
    <import src="jsf.ui.JButton"      autoload="button" />
    <import src="jsf.ui.JText"        autoload="textbox" />
    <import src="jsf.ui.JSplitButton" autoload="splitbutton" />
    <import src="jsf.ui.JMenu"        autoload="menu" />
    <import src="jsf.ui.JPanel"       autoload="panel" />
    <import src="jsf.ui.JSplitter"    autoload="splitter" />
    <import src="jsf.ui.JList"        autoload="list" />
    <import src="jsf.ui.JLabel"       autoload="label" />
    <import src="jsf.ui.JFormItem"    autoload="formitem" />
    
    <sprites name="icons" width="16" height="16" image="../themes/google/images/icons16.gif" />
    
    <!-- MENUS -->
    <menu name="menuArquivo" caption="Arquivo">
        <itens>
            <item label="Compartilhar" enabled="false" />
            <item label="-" />
            <item label="Novo" />
            <item label="Abrir" icon="[[2,3]]" />
            <item label="Renomear" />
            <item label="Fazer uma cópia" />
            <item label="Importar" />
            <item label="-" />
            <item label="Sair" />            
        </itens>
    </menu>
    <menu name="menuEditar" caption="Editar">
        <itens>
            <item label="Desfazer" />
            <item label="Refazer" />
            <item label="-" />
            <item label="Recortar" />
            <item label="Copiar" />
            <item label="Colar" />
            <item label="-" />
            <item label="Localizar e Substituir" />
            <item label="-" />
            <item label="Limpar" />
            <item label="Excluir Todos" />            
        </itens>
    </menu>
    
    <!-- INTERFACE -->
    <menubar itens='["menuArquivo","menuEditar"]' />
    <toolbar caption="Button" top="10" left="10">
        <button caption="Normal" width="100"/>
        <separator />
        <button caption="Disabled" enabled="false" />
        <separator />
        <button group="1" width="25" height="25" buttonStyle="flat" focuset="false"><caption><![CDATA[<b>N</b>]]></caption></button>
        <button group="1" width="25" height="25" buttonStyle="flat" focuset="false"><caption><![CDATA[<i>I</i>]]></caption></button>
        <button group="1" width="25" height="25" buttonStyle="flat" focuset="false"><caption><![CDATA[<u>U</u>]]></caption></button>
        <separator />
        <button caption="Togglet" togglet="true" iconMap="[[0,5]]" iconAlign="top" height="38" width="60" focuset="false" />
        <separator />
        <button iconMap="[[2,3]]" width="25" height="25" buttonStyle="flat" focuset="false" />
        <separator />
        <textbox />
        <separator />
        <splitbutton buttonStyle="flat" popup="menuArquivo" />
        <splitbutton />
    </toolbar>
    <container align="client" grap="4">
        <panel caption="Painel Esquerdo" align="left" grap="4">
            <list name="lstEsquerda" align="client" />
        </panel>
        <splitter margin="-4"/>
        <container align="client">
            <panel caption="Painel Direito" align="right">
                
            </panel>
            <splitter align="right"/>
            <panel caption="Painel Cliente" align="client">
                <container border="true" top="4" bottom="4" left="4" width="310">
                    <label top="3" left="4"><caption><![CDATA[<b style="font-size:14px">Form Elements</b>]]></caption></label>
                    <formitem top="30" caption="Nome:"><textbox /></formitem>
                    <formitem top="60" caption="Endereço:"><textbox /></formitem>
                    <formitem top="90" caption="Telefone Residencial:"><textbox /><textbox /></formitem>
                </container>
            </panel>
            <container height="120" align="bottom" border="true"></container>
            <splitter align="bottom"/>
        </container>
    </container>
    
</application>    
    